[
  {
    "id": "stt-en-0001",
    "language": "en",
    "region": "Accra urban",
    "speaker": { "id": "SPK-EN-001", "gender": "f", "ageBand": "30-49", "consentId": "CONSENT-PLACEHOLDER-001" },
    "audioPath": "content/samples/audio/generated/en-0001-placeholder.wav",
    "reference": "How do I register for the Ghana Card?",
    "condition": "quiet",
    "rights": "PLACEHOLDER: synthetic tone file generated by scripts/generate_sample_audio.py; contains no speech. Replace with a consented recording (see docs/07) before any evaluation run."
  },
  {
    "id": "stt-ak-asante-0001",
    "language": "ak-asante",
    "region": "Kumasi urban",
    "speaker": { "id": "SPK-AK-001", "gender": "m", "ageBand": "18-29", "consentId": "CONSENT-PLACEHOLDER-002" },
    "audioPath": "content/samples/audio/generated/ak-asante-0001-placeholder.wav",
    "reference": "Mɛyɛ dɛn akyerɛw me din agye Ghana Card?",
    "condition": "quiet",
    "rights": "PLACEHOLDER: synthetic tone file; contains no speech. Reference text drafted by the engineering team, pending native-speaker validation."
  },
  {
    "id": "stt-ak-akuapem-0001",
    "language": "ak-akuapem",
    "region": "Akropong",
    "speaker": { "id": "SPK-AKU-001", "gender": "f", "ageBand": "50+", "consentId": "CONSENT-PLACEHOLDER-003" },
    "audioPath": "content/samples/audio/generated/ak-akuapem-0001-placeholder.wav",
    "reference": "Bere bɛn na midua aburow?",
    "condition": "indoor-fan",
    "rights": "PLACEHOLDER: synthetic tone file; contains no speech. Reference text pending native-speaker validation."
  },
  {
    "id": "stt-ee-0001",
    "language": "ee",
    "region": "Ho",
    "speaker": { "id": "SPK-EE-001", "gender": "m", "ageBand": "30-49", "consentId": "CONSENT-PLACEHOLDER-004" },
    "audioPath": "content/samples/audio/generated/ee-0001-placeholder.wav",
    "reference": "Aleke mawɔ aŋlɔ ŋkɔ axɔ Ghana Card?",
    "condition": "market",
    "rights": "PLACEHOLDER: synthetic tone file; contains no speech. Reference text pending native-speaker validation."
  },
  {
    "id": "stt-gaa-0001",
    "language": "gaa",
    "region": "Accra, Jamestown",
    "speaker": { "id": "SPK-GA-001", "gender": "f", "ageBand": "18-29", "consentId": "CONSENT-PLACEHOLDER-005" },
    "audioPath": "content/samples/audio/generated/gaa-0001-placeholder.wav",
    "reference": "Mɛni feemɔ maŋmaa migbɛi kɛ Ghana Card?",
    "condition": "road",
    "rights": "PLACEHOLDER: synthetic tone file; contains no speech. Reference text pending native-speaker validation."
  }
]
